{
  "profile_id": "codex_cli_public_pack",
  "host_family": "codex",
  "host_backend": "codex_cli",
  "interaction_mode": "agent_assisted",
  "model_profile": "host_managed",
  "tool_policy_profile": "public_pack_bounded",
  "approval_mode": "host_managed",
  "capabilities": {
    "file_io": true,
    "shell_exec": true,
    "git_ops": true,
    "search": true
  }
}
